{
  "id": "durling_rime_sparse_1976",
  "author": "Robert M. Durling",
  "language": "english",
  "segments": [
    {
      "poem_nums": [
        4
      ],
      "text": "village: Laura's birthplace is unknown. Other poems seem to indicate that it was ona low hill in the plain between Vaucluse and Avignon, visible from the cliff above the fountain of Vaucluse.",
      "page": 56,
      "confidence": "auto"
    },
    {
      "poem_nums": [
        4
      ],
      "text": "eternally green boughs: the evergreen laurel, with an allusion to the myth of Apollo and Daphne. Daphne, daughter of the god of the river Peneus in Thessaly, was pursued by Apollo. She prayed to her father to preserve her vir- ginity, and when Apollo caught up with her she was transformed into a laurel. Apollo adopted the tree as his own and crowned himself with a wreath from it. (Ovid, Metamorphoses 1.452-567.) The laurel was supposedly immune from lightning. Its Latin name, laurus, was thought to derive from the verb laudare (to praise). Petrarch considered it the crown both of poets and of triumphing emperors.",
      "page": 58,
      "confidence": "auto"
    },
    {
      "poem_nums": [
        4
      ],
      "text": "The recipient of this poem has not been identified.",
      "page": 60,
      "confidence": "auto"
    },
    {
      "poem_nums": [
        16
      ],
      "text": "likeness of Him: the Veronica, said to be the kerchief with which Saint Veronica (Verum ikon, true image) wiped the face of Christ on the way to Cal- vary, retaining the image of His features. It is preserved in Saint Peter's basilica.",
      "page": 68,
      "confidence": "auto"
    },
    {
      "poem_nums": [
        18
      ],
      "text": "to see her: and I know well I am pursuing what burns me.",
      "page": 72,
      "confidence": "auto"
    },
    {
      "poem_nums": [
        22
      ],
      "text": "amorous wood: according to Virgil's account of the underworld (Aeneid 6), those who die for love are assigned to wander in a dark wood.",
      "page": 76,
      "confidence": "auto"
    },
    {
      "poem_nums": [
        22
      ],
      "text": "prouder river: the Rhone or the Durance, in Provence.",
      "page": 80,
      "confidence": "auto"
    },
    {
      "poem_nums": [
        22
      ],
      "text": "white feathers: an allusion to the myth of Cygnus. Phaeton persuaded his father, the sun god, to let him drive his chariot. When he lost control of it, Jupiter struck him down with a thunderbolt; he fell near the river Po, on the banks of which the nymphs built a tomb for him. His friend and relative Cygnus turned into a swan for grief. (Ovid, Metamorphoses 1.747-2.380.)",
      "page": 80,
      "confidence": "auto"
    },
    {
      "poem_nums": [
        22
      ],
      "text": "stone: an allusion to the myth of Battus. Battus saw Mercury stealing Apollo's oxen and for a reward promised Mercury not to reveal the theft. Later Mercury returned disguised and promised Battus a greater reward; Battus then disclosed it and Mercury made him into a stone. (Ovid, Metamorphoses 2.676-707.)",
      "page": 80,
      "confidence": "auto"
    },
    {
      "poem_nums": [
        23
      ],
      "text": "fountain: an allusion to the myth of Byblis. After a long struggle with herself, Byblis confessed her love for her brother in a letter to him. After his angry rejec- tion she wooed him until he fled to a foreign land, whereupon, grief-stricken, she was transformed into a fountain. (Ovid, Metamorphoses 9.454-665.)",
      "page": 82,
      "confidence": "auto"
    },
    {
      "poem_nums": [
        23
      ],
      "text": "stag: an allusion to the myth of Actaeon. The huntsman Actaeon, seeking shade and rest in the forest at noon, inadvertently came upon the goddess Diana and her nymphs bathing naked in a pool. Incensed at his presence, the goddess sprinkled water on his face, turning him into a stag. Actaeon fled, pursued by his own hounds, to which he vainly tried to identify himself, and was torn to pieces. (Ovid, Metamorphoses 3.138-252.)",
      "page": 84,
      "confidence": "auto"
    },
    {
      "poem_nums": [
        23
      ],
      "text": "cloud of gold: beloved by Jupiter, Danae was locked up in a tower by her father and was visited by the god in a rain of gold.",
      "page": 86,
      "confidence": "auto"
    },
    {
      "poem_nums": [
        23
      ],
      "text": "flame: Semele was consumed by lightning when she insisted on seeing her lover Jupiter in his true form.",
      "page": 86,
      "confidence": "auto"
    },
    {
      "poem_nums": [
        23
      ],
      "text": "bird: Jupiter, in the shape of an eagle, carried Ganymede off to Olympus.",
      "page": 86,
      "confidence": "auto"
    },
    {
      "poem_nums": [
        23
      ],
      "text": "A reply, using the same rhymes, to a sonnet by Andrea Stramazzo da Perugia (Appendix One, p. 603).",
      "page": 88,
      "confidence": "auto"
    },
    {
      "poem_nums": [
        23
      ],
      "text": "inventor of the first olives: Minerva, goddess of wisdom, friend of the Muses.",
      "page": 88,
      "confidence": "auto"
    },
    {
      "poem_nums": [
        29
      ],
      "text": "The recipients of this poem and the next have not been identified.",
      "page": 88,
      "confidence": "auto"
    },
    {
      "poem_nums": [
        26
      ],
      "text": "The recipient of this poem has not been identified.",
      "page": 90,
      "confidence": "auto"
    },
    {
      "poem_nums": [
        26
      ],
      "text": "successor of Charles: Philip VI of France, the successor of Charles V (and, ul- timately, of Charlemagne), declared a Crusade against the Moslems in 1334.",
      "page": 90,
      "confidence": "auto"
    },
    {
      "poem_nums": [
        26
      ],
      "text": "Babylon: Baghdad or Cairo, considered the chief seats of Moslem power.",
      "page": 90,
      "confidence": "auto"
    },
    {
      "poem_nums": [
        27
      ],
      "text": "The recipient of this poem has not been identified.",
      "page": 92,
      "confidence": "auto"
    },
    {
      "poem_nums": [
        27
      ],
      "text": "western wind: Philip VI's proclamation of the Crusade, Paris being to the west of Rome.",
      "page": 92,
      "confidence": "auto"
    },
    {
      "poem_nums": [
        28
      ],
      "text": "Most Christian: title claimed by the kings of France.",
      "page": 94,
      "confidence": "auto"
    },
    {
      "poem_nums": [
        28
      ],
      "text": "those who hope in gods: the Moslems, who were supposed by medieval Christians to be polytheists. entrust...blows",
      "page": 94,
      "confidence": "auto"
    },
    {
      "poem_nums": [
        28
      ],
      "text": "to the wind: the Turks were famous as archers.",
      "page": 94,
      "confidence": "auto"
    },
    {
      "poem_nums": [
        28
      ],
      "text": "Orpheus and Amphion: said to move trees and stones, respectively, with their songs.",
      "page": 96,
      "confidence": "auto"
    },
    {
      "poem_nums": [
        28
      ],
      "text": "son of Mars: Romulus, legendary founder of Rome.",
      "page": 96,
      "confidence": "auto"
    },
    {
      "poem_nums": [
        28
      ],
      "text": "Xerxes: Xerxes I of Persia, who invaded Greece via the Hellespoint with a bridge constructed of ships. He was defeated in a naval battle at Salamis (480 B.C.) and in several land battles.",
      "page": 98,
      "confidence": "auto"
    },
    {
      "poem_nums": [
        28
      ],
      "text": "Marathon: battle (490 B.C.) in which Darius I (Xerxes' father), invader of Greece, was finally defeated.",
      "page": 98,
      "confidence": "auto"
    },
    {
      "poem_nums": [
        28
      ],
      "text": "mortal straits: the mountain pass of Thermopylae, defended against Xerxes by Spartan troops under Leonidas (“the Lion”).",
      "page": 98,
      "confidence": "auto"
    },
    {
      "poem_nums": [
        29
      ],
      "text": "one driven like me: Dido, who killed herself with Aeneas' sword when he abandoned her. lightning...unworthy",
      "page": 102,
      "confidence": "auto"
    },
    {
      "poem_nums": [
        29
      ],
      "text": "wind: allegorically, passion.",
      "page": 102,
      "confidence": "auto"
    },
    {
      "poem_nums": [
        30
      ],
      "text": "under the fourth nest: lower than the sun; therefore in the sphere of the moon, of Mercury, or of Venus.",
      "page": 108,
      "confidence": "auto"
    },
    {
      "poem_nums": [
        30
      ],
      "text": "higher: that is, to the sphere of Jupiter, the sixth; of Saturn, the seventh; or of the fixed stars, the eighth.",
      "page": 108,
      "confidence": "auto"
    },
    {
      "poem_nums": [
        32
      ],
      "text": "star of love: the planet Venus as the morning star. other...jealous: Juno, jealous of Jupiter's love for Callisto, turned her and her son Arcas into bears, whereupon Jupiter made them constellations, Ursa Major and Ursa Minor, respectively.",
      "page": 110,
      "confidence": "auto"
    },
    {
      "poem_nums": [
        34
      ],
      "text": "Thessalian waves: for the myth of Apollo and Daphne, see note to poem S.",
      "page": 110,
      "confidence": "auto"
    },
    {
      "poem_nums": [
        37
      ],
      "text": "I say more: my returning to what one flees and my freeing my heart of so great a fear were no small pledge of my faithfulness toward you. Addressed to an unidentified person, presumably a resident of Avignon.",
      "page": 122,
      "confidence": "auto"
    },
    {
      "poem_nums": [
        39
      ],